ID,Condition,Joke,Critical,Meaning1,Meaning2,key_resp_sentence.rt,key_resp_relatedness.rt,key_resp_IsItJoke.rt,slider_IsItFunny_responseValue,slider_IsItFunny_responseTime,Correct,key_resp_sentence.rt_winsor,key_resp_relatedness.rt_winsor,key_resp_IsItJoke.rt_winsor,slider_IsItFunny_responseTime_winsor,N_correct
11.0,Sense2,The circus hires clowns because they are funny,FUNNY,WEIRD,LAUGHTER,6.621066666666667,3.6367,1.4427833333333335,1.8333333333333333,1.5975000000000001,1.0,3.874829999999999,2.275505833333332,1.4427833333333335,1.6047033333333334,6
3.0,Sense1,Two friends got married. The reception was fantastic,RECEPTION,SIGNAL,PARTY,2.85405,1.2134625,2.1227375,1.875,1.5991875,1.0,3.053855,1.2665675,2.1227375,1.5562524999999998,8
38.0,Joke,"-This coffee tastes like mud 
-Well, it was just ground this morning!",GROUND,DIRT,CRUSH,4.258533333333333,1.8575777777777778,2.0365777777777776,4.333333333333333,1.478811111111111,1.0,4.258533333333333,1.8814711111111113,2.0267388888888886,1.4873577777777778,9
35.0,Joke,The communist loved the summer because there were no classes,CLASSES,SCHOOL,STATUS,3.282842857,1.5527714285714287,1.1991285712857143,4.0,1.0432571428571429,1.0,3.3285835712857144,1.57446,1.2380292857142856,1.1309114285714286,7
16.0,Sense2,You can't breathe on the moon because there's no atmosphere,ATMOSPHERE,LIVELY,OXYGEN,2.7821625,0.967825,1.284850000125,1.5,1.2579375,1.0,2.838535625,0.984155,1.284850000125,1.28484,8
4.0,Sense1,"The lawyer was not great at her job, she got fired",FIRED,BURN,UNEMPLOYED,3.2037833333333334,1.05195,1.8218500001666669,1.3333333333333333,1.0715833333333333,1.0,3.2037833333333334,1.05195,1.8218500001666669,1.0864866666666666,6
7.0,Sense1,The woman was cross-eyed because she could not control her pupils,PUPILS,STUDENTS,EYES,3.4772,1.22724,2.43276,1.2,1.1551,1.0,3.4772,1.262508,2.1013089999999996,1.1551,5
13.0,Sense2,The bank had to fire a few employees because it had too many tellers,TELLERS,GOSSIP,CASHIER,4.540666666666667,1.3261222222222222,1.6029222222222221,2.0,1.1796333333333333,1.0,4.450399444444444,1.3629377777777778,1.6045227777777777,1.2041266666666666,9
37.0,Joke,It's hard for leopards to hide as they're always spotted.,SPOTTED,SEEN,PATTERNED,3.0513000000000003,1.1882285714285714,1.6125000001428569,4.285714285714286,1.3611285714285712,1.0,3.0513000000000003,1.1882285714285714,1.621987143,1.3611285714285712,7
20.0,Sense2,Mac users get fewer viruses because they don't have Windows,WINDOWS,COMPUTER,GLASS,3.1117999999999997,1.4665857142857142,1.417,1.5714285714285714,2.4524857142857144,1.0,3.1202550000000002,1.4858171428571427,1.431672142857143,2.179271428571428,7
8.0,Sense1,I told her I was going to make her mine. She loved the idea of marrying me,MINE,BELONG,QUARRY,6.27032,1.23507,2.67665,1.6,1.64887,1.0,4.948179499999999,1.23507,1.6909949999999998,1.64887,10
6.0,Sense1,The problem with thieves is that they always take other people's things,TAKE,STOLEN,PERSPECTIVE,4.16424,1.1397599999,1.51906,1.6,1.33497,1.0,3.921719499999999,1.1882659999,1.5047249999999999,1.33497,10
